,Name,Purpose
1,"Mann, Young and Jordan",Sharable reciprocal artificial intelligence for enhance 24/7 experiences
2,Potter-Jenkins,Persevering 3rdgeneration solution for generate proactive architectures
3,"Pena, Johnson and Charles",Balanced user-facing capacity for cultivate web-enabled supply-chains
4,Howard-Jones,Organic impactful model for visualize impactful methodologies
5,Allison LLC,Re-engineered user-facing infrastructure for integrate distributed interfaces
6,"Hobbs, Nguyen and Reese",Virtual maximized encoding for target cutting-edge supply-chains
7,Clarke LLC,Extended optimizing database for whiteboard strategic info-mediaries
8,Sanchez LLC,Business-focused mission-critical algorithm for enable B2C e-commerce
9,"Scott, Smith and Baker",Optimized full-range adapter for extend strategic solutions
10,Ali-Scott,Phased uniform productivity for visualize impactful e-commerce
11,Taylor Group,Universal zero administration paradigm for transform real-time experiences
12,Williams LLC,Right-sized even-keeled adapter for incentivize web-enabled functionalities
13,Taylor PLC,Robust intermediate intranet for synergize distributed partnerships
14,"Martin, Diaz and Parks",Secured mobile middleware for envisioneer sticky eyeballs
15,Burke-Ayers,Future-proofed bi-directional software for expedite seamless e-tailers
16,Rose-Nielsen,Optional bi-directional challenge for leverage granular web-readiness
17,Arroyo PLC,Balanced multimedia encryption for embrace open-source synergies
18,"Young, Simmons and James",Right-sized tangible functionalities for drive intuitive channels
19,Banks Group,Organized background instruction set for unleash cross-media systems
20,"Hunt, Gutierrez and Gonzalez",Quality-focused didactic pricing structure for revolutionize turn-key web-readiness
21,Henderson and Sons,Ergonomic next generation model for repurpose magnetic deliverables
22,Mcdonald and Sons,Intuitive bottom-line focus group for transition value-added users
23,Zamora Ltd,Innovative web-enabled data-warehouse for incubate ubiquitous mindshare
24,"Thomas, Campos and Munoz",Function-based exuding implementation for morph holistic mindshare
25,Vazquez Inc,Self-enabling scalable standardization for re-intermediate enterprise e-services
26,"Valdez, Jackson and Gomez",User-friendly needs-based archive for whiteboard 24/365 systems
27,Graves Group,Quality-focused 24/7 productivity for reinvent revolutionary vortals
28,Baker-Wyatt,Expanded composite Graphical User Interface for repurpose clicks-and-mortar platforms
29,"Montgomery, Sutton and Richard",Grass-roots interactive approach for productize compelling channels
30,Henry LLC,Integrated intermediate benchmark for empower cross-platform convergence
31,Black and Sons,Monitored user-facing moderator for innovate open-source web services
32,"Williams, Daniel and Weaver",Open-architected motivating interface for facilitate turn-key web-readiness
33,Willis Ltd,Self-enabling dedicated capability for revolutionize out-of-the-box technologies
34,Taylor-Green,Adaptive full-range secured line for iterate scalable web services
35,Davidson and Sons,Reduced heuristic interface for seize granular infrastructures
36,Harmon Inc,Up-sized value-added definition for e-enable integrated functionalities
37,"Collins, Rivera and Scott",Inverse zero-defect paradigm for generate mission-critical relationships
38,Thomas-Nichols,Vision-oriented grid-enabled open architecture for harness extensible interfaces
39,"Velasquez, Mccarthy and West",Operative leadingedge time-frame for re-contextualize 24/365 e-business
40,Brown-Johnson,Optional client-driven hierarchy for productize out-of-the-box networks
41,Gonzalez-Jones,Grass-roots 5thgeneration Internet solution for visualize seamless systems
42,"Flowers, Schultz and Anderson",Advanced high-level paradigm for synergize bleeding-edge functionalities
43,French-Garcia,Mandatory intangible pricing structure for engage next-generation e-business
44,Robertson Ltd,Triple-buffered transitional framework for aggregate ubiquitous initiatives
45,Reyes-Harris,Enterprise-wide fresh-thinking extranet for deliver web-enabled initiatives
46,Bender Group,Sharable systemic knowledge user for strategize world-class interfaces
47,"Christensen, Jones and Craig",User-friendly context-sensitive software for leverage next-generation models
48,"Garcia, Edwards and Webb",Future-proofed asymmetric architecture for synergize killer content
49,"Harrison, Norton and Nguyen",Front-line optimizing data-warehouse for productize bricks-and-clicks vortals
50,Cruz-Nelson,Fully-configurable heuristic flexibility for expedite e-business platforms
